text	label
IM号:oTkr9jv2PBV1FlGxfyUPIuy9xfVQ,自己在异地，对号码停机不认可，需要尽快核实，停机类型:骚扰单停；处理工号:hb；通话频繁的原因（不涉及填无）:停机标识:疑似电话骚扰被停机用户服务口径:您的号码呼叫行为异常，疑似造成电话骚扰，根据国家有关规定，为维护电信用户的合法权益，暂停您的号码外呼功能。感谢您的理解和支持。请您携带有效身份证件，到中国电信自有营业厅办理实名登记业务并签订承诺书后电话会自动复机，感谢您的理解和支持；单位全称（个人填个人）:个人；能否提供工作证明:个人使用，不涉及；机主身份姓名:姜学莉；机主身份证辅助项（三选一）:开卡地市；用户不认可项:。	身份核验复机问题
对宽带套餐费用不认可，称自己压根就没有办理宽带，为什么会有费用产生，用户要求将宽带费用全部退还。	客户需求,取消并争议费用
安装机顶盒优先通过催装移场景诊断:否（前新装订单,流程是否竣工:是；是否已上门安装:否；受理订单产品类型:ITV；业务受理类型:装机。	安装宽带、itv、摄像头
1.主叫号码,2.受理号码,3.联系号码,4.生单原因宣传与活动不一致5.订单号XW6.用户需求:,宣传时告知的是通用流量有50G，经查询通用流量加起来只有30G。	宣传与活动不一致
客户，通过自有营业厅咨询/办理业务时，对解释说明不清表示不满意，要求核查处理，客服代表安抚无效，请协助处理,业务类型:销售品成员变更【5G云套餐十全十美199元档,营业厅名称:长江新区堤角营业厅；工作人员工号/特征:刘雨翔,用户称营业厅答应流量按照两次返还，但是只返了一次，要求营业厅再次联系用户返还流量，请联系，前期工单流水:，前期,再次联系用户，用户上月未结转流量为17G，已于用户说明我处为其充值流量，用户无异议。；要求针对用户套餐变更没有告知流量不结转的问题进行处理；投诉11月13日通过营业厅办理了套餐变更为十全十美5G云套餐199元资费，用户称上个月的流量未使用完为什么没有结转到本月，我处核实到因为套餐资费发生变更，用户称当时办理业务调整时营业厅没有告知。	业务办理问题
用户号码市级骚扰停机，机主在外地，无法去营业厅，想要复机，请协助核实，请尽快核实并与其联系，停机类型:骚扰单停；处理工号:yc；通话频繁的原因（不涉及填无）:不涉及；单位全称（个人填个人）:个人；能否提供工作证明:个人使用，不涉及；机主身份姓名:李程；机主身份证辅助项（三选一）:开卡地市；用户不认可项:。	身份核验复机问题
:在线退订失败,用户要求退费SP编码/产品编码:,商品名称/扣费项:王者荣耀专属包,资费:10。	退订增值业务并退费
:在线退订失败,用户要求退费SP编码/产品编码:,商品名称/扣费项:王者荣耀60点券,资费:6SP编码/产品编码:,商品名称/扣费项:王者荣耀300点券,资费:30。	退订增值业务并退费
短信故障现象:无法收发；短信拦截类型:拦截；测试短信情况:不涉及,2021,1209,工单处理时限提醒话术:我们马上核实处理，36小时内会有专人联系您。	短信无法收发
:在线退订失败,用户要求取消业务SP编码/产品编码:,商品名称/扣费项:喜马拉雅畅听包,资费:10用户要求退费SP编码/产品编码:,商品名称/扣费项:喜马拉雅畅听包,资费:10。	退订增值业务并退费
客户反映手机终端-4G终端-Honor,COL-AL10_社出现故障，查询终端配件设备归属:客户，客户要求核查并处理，请协助跟进。是否在保修范围内:否,0；省网优预,一键检测费用正常、未断网、未降速，联系用户坚持称在不定区域上网不好未恢复，建议用户换机换卡不认可，请进一步核实（上午在考试，要求下午2点后联系,周围用户是否正常】:否【经度】:111,纬度】:30,地址】:宜昌市伍家区伍临路36-6号城中半岛1001号商铺【地址id,基站id,4G开关是否开启】:是【受理号码,故障预处理】:本地无法上网【故障场景】:所有位置【故障现象】:无信号【故障发生时间】,点【检测BOSS侧付费模式和欠费情况】:后付费【是否存在异常话单】:无异常话单【是否被列入AAA黑名单】:否【boss是否开通2G、3G、4G功能】:2G:开通,3G:开通,4G:开通【检测BOSS侧停开机状态】:开机【检测30天内在途工单】:30天内无在途单【检查BOSS是否已经发送达量降速】:查询失败【检查PGW是否已经发送达量降速】:PGW未发送达量降速(用户在线且当前网络为4G网,检测HSS侧停开机状态】:开机【检测网元侧4G功能是否开通】:4G功能已开通【检测BOSS是否断网】:未断网【检测上网话单（仅供内部参考,20分钟以内未产生话单【检测无线网状况是否故障】:查询失败【检测当前是否有上网超阈值记录】:上网流量没有超断网阀值已建议用户检测手机网络数据开关及重启手机/换机换卡操作，用户未恢复，手机卡经常信号不稳定，无法使用网络和通话，套餐内号码也存在此问题，最近三个月开始的，需要下午2点之后联系。	语音或上网无法使用
其在外地，需要将号码复机，停开机类型（停机原因-停开机记录区查-看详情）:二次实人核验单停；处理工号（停机原因-停开机记录区查-看详情）:es；无法到厅开机原因:人在外地。	用户反应机主在外地,需要线上复机！,用户要求线上开机,用户意见很大有越级投诉倾向,请核实联系
用户号码认为在，,对用户号码进行骚扰，推销保健品，都是外地的固话,内容:食药推销，通话时长:3分钟内，接收电话形式:人工拨打。举报时间,备注:用户要求举报核查处理:被举报号码:（无法识别归属地,无法查询归属地），请派单信安部处理。	用户接到骚扰 / 诈骗电话
业务名称:[附]七彩铃音；号码状态:正常；投诉问题类型:费用争议；故障或争议时间,我的音乐盒,包月,未退订,未退费,用户对彩铃功能及音乐盒开通不认可，称没有自己点播开通。	彩铃、视频彩铃、音乐盒
反映号卡被关停，不方便去营业厅，要求开机,停开机类型（停机原因-停开机记录区查-看详情）:非实名违章双停；处理工号（停机原因-停开机记录区查-看详情）:hb；无法到厅开机原因:不方便距离远。	用户反应机主在外地,需要线上复机！,用户要求线上开机,用户意见很大有越级投诉倾向,请核实联系
用户号码状态正常，发送号码正确且未被对方设置拦截，不认可配合换机测试，所有。	短信无法收发
1.否认办理业务:电子渠道活动-6个月合约,2.受理渠道:沙洋县高阳浩瀚全网通卖场3.订单记录:购物车流水:4.机主身份证:X5.用户要求:否认办理，根据办理订单解释，用户不认可。	否认改套餐、办理业务
称自己从来没有使用过此号码，今天刚刚拿出来，但是查询自己号码被停机，已按口径解释，用户对停机不认可，要求详细核实,停机类型:骚扰单停；处理工号:es；通话频繁的原因（不涉及填无）:个人；单位全称（个人填个人）:个人；能否提供工作证明:个人使用，不涉及；机主身份姓名:黄和；机主身份证号:X；辅助项（三选一）:开卡地市；用户不认可项:停机原因。	异常停机不认可
用户反馈套餐有续费年费，但专款费用只能抵扣手机套餐消费，但用户套餐129元费用是在宽带上出费用，导致出现宽带月租欠费，请核实设置宽带账号在专款余额中，避免影响用户使用，用户很急，要求尽快处理问题,王世立,027-@ADSL,套餐--宽带接入费(全家福,实时费用。	费用争议
删除济南,增加,14天内行程情况:更新于,您于前14天内到达或途径:济南、武汉；行程轨迹故障现象:多行程；异常省份:济南,反映一直在武汉使用，没有出过武汉，现行程显示多了一个济南，请核实回复。	行程轨迹（多行程、无行程、少行程）
已发号测试短信，用户接收成功但不认可自助排障,汉口银行。	测试短信接收成功，不认可自助排障
用户号码状态正常，发送号码正确且未被对方设置拦截，不认可配合换机测试。	号码正常，短信未拦截，不配合换机测试
用户现在在长沙，不方便回归属地，要求协助线上复机，否则要求离网,停机类型:骚扰单停；处理工号:hb；通话频繁的原因（不涉及填无）:工程方面的工作，跟客户联系比较多；单位全称（个人填个人）:谢唐辉；能否提供工作证明:个人使用，不涉及；机主身份姓名:谢唐辉；机主身份证辅助项（三选一）:开卡地市；用户不认可项:。	骚扰单停
客户通过自有营业厅咨询/办理业务时，对服务态度表示不满意，要求核查处理，客服代表安抚无效，请协助处理,业务类型:拿副卡；营业厅名称:赤壁赵李桥电信营业厅,用户反映自己去赤壁赵李桥电信营业厅办理业务，该营业厅工作时间内没有开门，意见大，长时间，请核实并回复。；用户反映自己去赤壁赵李桥电信营业厅办理业务，该营业厅工作时间内没有开门，意见大，长时间，请核实并回复。	否认改套餐、办理业务
用户反映自己在武汉开的卡，因工作原因现在襄阳保康使用电话打的比较多，无法回归属地办理身份核验开卡时间:用户答停机类型:骚扰单停；处理工号:wh；通话频繁的原因（不涉及填无）:工作需求；单位全称（个人填个人）:保康县马桥镇人民政府；能否提供工作证明:可以（工作证、盖公章的证明书、工作照片等,机主身份姓名,机主身份证辅助项（三选一）:开卡年份；用户不认可项:。	身份核验复机问题
用户号卡遗失，需要线上核验身份停开机类型（停机原因-停开机记录区查-看详情）:沉默移动卡保护性单停；处理工号（停机原因-停开机记录区查-看详情）:不涉及；无法到厅开机原因,用户号卡遗失，需要线上核验身份。	用户表示人在外地,不方便前往营业厅,询问线上有没有解决方法,请求处理！！,用户要求线上帮忙开机,用户有离网的意向,麻烦请尽快核实处理
短信故障现象:无法收发；短信拦截类型:未拦截；测试短信情况:不涉及,生单原因:短信权限问题导致无法发送,工单处理时限提醒话术:我们马上核实处理，36小时内会有专人联系您。	短信无法收发
短信故障现象:无法发送；短信拦截类型:拦截；测试短信情况:不涉及,工单处理时限提醒话术:我们马上核实处理，36小时内会有专人联系您。	用户接到骚扰 / 诈骗电话
1.受理渠道:武汉汇乐购电子商务有限公司2.订单记录:购物车流水:3.机主身份证:4.用户要求:否认办理，根据办理订单解释，用户不认可。	否认改套餐、办理业务
自己一次积分都没有兑换过，产生了兑换记录，对此不认可，要求电信处理，麻烦核实处理场景类型:全国积分（商城网址:jf.189.cn）问题类型:积分兑换问题当前可用积分:0当前星级:0积分兑换记录,兑换/清零,0305,0,电竞风云,湖北电信ITV综合业务管理平台。	积分兑换
用户拨打业务电话比较频繁被单向停机，比较着急工作需要使用手机号码，希望尽快核实处理停机类型:骚扰单停；处理工号:hb；通话频繁的原因（不涉及填无）:工作原因；单位全称（个人填个人）:胜科；能否提供工作证明:可以（工作证、盖公章的证明书、工作照片等,机主身份姓名:赵嘉乐；机主身份证辅助项（三选一）:开卡地市；用户不认可项:停机原因。	身份核验复机问题
用户要求携出，有靓号49元保底，请核实。	客户需求,取消并争议费用
短信故障现象:无法收发；短信拦截类型:拦截；测试短信情况:不涉及,工单处理时限提醒话术:我们马上核实处理，36小时内会有专人联系您。	用户接到骚扰 / 诈骗电话
客户，通过合作营业厅咨询/办理业务时，对解释说明不清表示不满意，要求核查处理，客服代表安抚无效，请协助处理,业务类型:订购销售品【5G云套餐畅享199元档,营业厅名称:汉阳国美王家湾商城手机卖场；工作人员工号/特征:彭莲,反映办理此5G套餐时工作人员告知流量是无限使用的，已告知用户套餐资费详情，用户不认可，强烈,请核实回复；反映办理此5G套餐时工作人员告知流量是无限使用的，已告知用户套餐资费详情，用户不认可，强烈,请核实回复。	业务办理问题
用户对于11月短信费用超出不认可，麻烦联系处理，争议费用情况:大于5元。	费用争议
用户反馈办理的是99元套餐，,包含宽带业务，但上个月宽带收取了100元费用，本月宽带月租费用一直产生费用，请尽快核实宽带月租收费问题。jza@kd,套餐--宽带接入费,jza,套餐--宽带接入费。	费用争议
反映上个月办理了两个199融合套餐，但扣费有问题，查看其中一条宽带和电视应该是套餐内免费的但收费了，请协助核实处理回复,yca@kd,宽带月租,yci,套餐--ITV使用费,争议类型:月租费争议争议费用情况:大于5元争议月份:争议扣费记录:,yca@kd,宽带月租,套餐定价计划:智慧家庭融合版199(松融合。	费用争议
漫游地（省外）:上海市；具体使用地址:上海市宝山区杨行镇杨北中心村；省际漫游投诉问题:上网；故障发生时间:12月12日；号码状态:正常；4G-LTE及国漫功能:已开通；手机是否已启用4G功能:已启用；漫出地4G信号覆盖:有4G信号覆盖；手机终端类型:5G终端,反映在上海无法使用流量上网，已在线解释号码已降速，建议订购提速包，用户不认可，请核实尽快处理。	漫游语音/上网问题
短信故障现象:无法收发；短信拦截类型:拦截；测试短信情况:不涉及,工单处理时限提醒话术:我们马上核实处理，36小时内会有专人联系您。	用户接到骚扰 / 诈骗电话
机主和手机卡不在同一个地方，无法办理复机，请尽快核实回电,套餐里面的3个号码都是同样情况，号码分别是,是否停机:是（请进行下一步,停机类型:大数据分析号码身份核验；停机时间:hbunfraud02；处理工号是否是hb:是。	异常停机 需要复机
用户反映自己第二条宽带一年到期后未使用，但是一直在扣取费用,要求退还费用，请核实联系。争议类型:月租费争议争议费用情况:大于5元争议月份:争议扣费记录:@kd,套餐--宽带接入费,套餐定价计划:十全十美第二条宽带+电视(高清ITV)40元/月。	费用争议
漫游地（省外）:广东省；具体使用地址:广东省深圳市宝安区；省际漫游投诉问题:上网；故障发生时间,号码状态:正常；4G-LTE及国漫功能:已开通；手机是否已启用4G功能:已启用；漫出地4G信号覆盖:有4G信号覆盖；手机终端类型:4G终端,此为重复来电用户）用户反映上网网速很慢，换机换卡测试无效，请尽快联系处理。	漫游语音/上网问题
增加湖北黄冈#14天内行程情况:更新于,您于前14天内到达或途径:无查询结果；行程轨迹故障现象:无行程；异常省份:湖北,用户称自己最近14天都在黄冈，现在上班需要扫行程卡，但是每次都提示无结果，要求修正，请尽快核实回复。	行程轨迹（多行程、无行程、少行程）
故障现象:无信号；故障场景:所有位置；故障类型:上网；网络类型:4G；地图地址:0；地图经度:0；地图纬度:0；地图基站id:0；故障发生时间:0；手机型号:0,0；省网优预,开通NSA功能，5G套餐，一键检测费用正常、未断网、未降速，1511联系用户提示通话中，地址不详，工单描述近期上网频繁没有信号，请进一步核实,故障地址】:从襄阳到随州的高速路上【周围用户是否正常】:不清楚【经度】:112,纬度】:31,地址】:从襄阳到随州的高速路上【地址id,基站id,4G开关是否开启】:是【受理号码,故障预处理】:本地上网慢【故障场景】:部分/单一位置【故障发生时间】,点【是否存在异常话单】:无异常话单【是否被列入AAA黑名单】:否【boss是否开通2G、3G、4G功能】:2G:开通,3G:开通,4G:开通【检测BOSS侧停开机状态】:开机【检测30天内在途工单】:30天内无在途单【检查BOSS是否已经发送达量降速】:非畅想套餐【检查PGW是否已经发送达量降速】:PGW未发送达量降速(用户在线且当前网络为4G网,检测HSS侧停开机状态】:开机【检测网元侧4G功能是否开通】:4G功能已开通【检测BOSS是否断网】:未断网【检测无线网状况是否故障】:查询失败【检测当前是否有上网超阈值记录】:上网流量没有超断网阀值查询失败，已建议用户换机换卡，用户未恢复，称流量上网慢问题是这几天一直频繁出现的。	语音或上网无法使用
用户号码状态正常，发送号码正确且未被对方设置拦截，不认可配合换机测试，-15。	短信无法发送
用户在收到发送短信，短信内容（简述）:通信行程卡短信,收到通信行程卡垃圾短信，请尽快核实处理。	屏蔽骚扰短信
省网优预,经核实用户号码数据正常，无话务拦截，无呼叫转移，用户开通VoLTE，未注册VoLTE。用户呼入呼出状态正常。我处多次拨打用户未接提示音异常（无法接通），请相关工作人员核实处理,故障地址】:孝感市孝感市区长征路10号【周围用户是否正常】:不清楚【经度】:113,纬度】:30,地址】:孝感市孝感市区长征路10号【地址id,基站id,受理号码,故障预处理】:本地无法主被叫【故障场景】:部分/单一位置【故障现象】:信号弱，不稳定【故障发生时间】,点【检测BOSS侧付费模式和欠费情况】:后付费【是否存在异常话单】:无异常话单【HLR用户是否登网（关机状态检测,开机【HLR漫游权限查询】:国内漫游【检测BOSS侧停开机状态】:开机【检测30天内在途工单】:30天内无在途单【检测HLR侧停开机状态】:开机【呼叫权限】:国内呼叫【MSCID位置（仅供内部参考,检测无异常，有位置信息:湖北省孝感【检测无线网状况是否故障】:正常【检测当前是否有拨异网号码超阈值记录】:拨异网号码语音时长没有达阀值【检测HSS中VoLTE数据状态】:正常【检测VOLTE平台用户状态】:用户可以正常呼出呼入【检测ENUM开户数据是否存在】:ENUM开户数据存在【检测用户volte注册状态】:用户未注册VOLTE功能查询失败，已建议用户换机换卡，用户未恢复。	语音或上网无法使用
用户在,收到发送短信，短信内容（简述）:验证码,用户反映昨天晚上到现在每半小时就会收到的验证码，要求拦截。	屏蔽骚扰短信
短信故障现象:无法收发；短信拦截类型:拦截；测试短信情况:不涉及,工单处理时限提醒话术:我们马上核实处理，36小时内会有专人联系您。	短信无法收发
套餐名称:武汉-商务领航Ta-7基础包-36元/1月-专业市场；套餐销售品ID,电子发票投诉问题:重新推送成功仍未收到；开票状态:开票成功；争议月份,发票金额（元,发票邮箱:jhybjb@126.com,用户称收不到11月份的消费发票,用户称收不到11月份的消费发票。	发票问题
用户号码认为,在，,对用户号码进行骚扰，内容:，通话时长:3分钟内，接收电话形式:录音电话。举报时间,备注:用户要求举报核查处理:被举报号码:（中国移动-北京）请派单省业务平台维护中心处理。	用户接到骚扰 / 诈骗电话
要求取消电子渠道活动-6个月合约,表示自己办理就是不想要合约，对此不满，要求公司处理。	客户想要取消电子渠道活动-6个月合约,请核实一下
短信故障现象:无法接收；短信拦截类型:未拦截；测试短信情况:不涉及,生单原因:短信权限问题导致无法发送,工单处理时限提醒话术:我们马上核实处理，36小时内会有专人联系您。	短信无法收发
短信故障现象:无法收发；短信拦截类型:拦截；测试短信情况:不涉及,工单处理时限提醒话术:我们马上核实处理，36小时内会有专人联系您。	短信无法收发
反映电视没安装，需要师傅安装电视，麻烦核实联系用户优先通过催装移场景诊断:否（前新装订单,流程是否竣工:是；是否已上门安装:否；受理订单产品类型:ITV；业务受理类型:装机。	安装宽带、itv、摄像头
故障现象:无信号；故障场景:所有位置；故障类型:上网；网络类型:4G；地图地址:1；地图经度:1；地图纬度:1；地图基站id:1；故障发生时间:1；手机型号:1,1；省网优预,4G套餐，一键检测费用正常、未断网、未降速，4G不在线，多次联系用户提示关机，请进一步核实。	本地无法主被叫/上网
用户号码状态正常，发送号码正确且未被对方设置拦截，不认可配合换机测试，-10。	号码正常，短信未拦截，不配合换机测试
故障地址】:恩施州利川市清江大道东方城3号楼17楼1702【周围用户是否正常】:是【经度】:108,纬度】:30,地址】:恩施州利川市清江大道东方城3号楼17楼1702【地址id,基站id,受理号码,故障预处理】:本地无法主被叫【故障场景】:部分/单一位置【故障现象】:有信号，正常【故障发生时间】,点【检测BOSS侧付费模式和欠费情况】:后付费【是否存在异常话单】:无异常话单【HLR用户是否登网（关机状态检测,开机【HLR漫游权限查询】:国内漫游,检测BOSS侧停开机状态】:开机【检测30天内在途工单】:30天内无在途单,检测HLR侧停开机状态】:开机【呼叫权限】:国内呼叫【MSCID位置（仅供内部参考,检测无异常，有位置信息:湖北省恩施【检测无线网状况是否故障】:正常【检测是否是5G用户】:是5G用户【检测当前是否有拨异网号码超阈值记录】:拨异网号码语音时长没有达阀值【检测HSS中VoLTE数据状态】:正常【检测VOLTE平台用户状态】:用户可以正常呼出呼入【检测ENUM开户数据是否存在】:ENUM开户数据存在【检测用户volte注册状态】:用户已注册VOLTE功能重启手机或拔插卡，用户未恢复。	本地无法主被叫/上网
爱游戏信息费,如增值场景无显示，不一定是按次收费业务，可点击增值历史退费生单-增值取消,基础销售品电信手机,爱音乐音乐下载信息费,基础销售品电信手机。	彩铃、视频彩铃、音乐盒
套餐名称:5G云套餐十全十美199元档；套餐销售品ID,号码状态:正常；投诉业务名称:视频彩铃功能使用费；投诉问题类型:费用争议；销售品名称:5G云套餐十全十美199元档；销售品实例ID,办理渠道,故障或争议月份,同上；用户要求退费，号码都有视屏彩铃功能都不收费，只有本号收费，请核实。	投诉场景
已发号测试短信，用户接收成功但不认可自助排障。	测试短信接收成功，不认可自助排障
漫游地（省外）:广东湛江；具体使用地址:湛江广州大道海警局（码头,省际漫游投诉问题:语音或语音、上网均无法使用；故障发生时间,号码状态:正常；漫游功能:已开通,用户称信号很差，湛江本地客服无法处理外地号码，请尽快联系处理。	漫游语音/上网问题
用户积分兑换入口:省内积分商城,积分兑换物品类型:优品包；积分兑换渠道:湖北电信ITV综合业务管理平台；积分兑换物品:优品影视月包；积分兑换单积分争议类型:非本人签收,积分异动日期为:，异动为:兑换/清零，异动积分为:，积分值为:1902，兑换凭单号为:，兑换物品为:优品影视月包，兑换渠道为:湖北电信ITV综合业务管理平台。	积分兑换
自己收到短信需要重新进行实名核验，但是目前核实到自己号码状态是正常的，建议用户关注使用但是用户不认可，并回复停开机类型（停机原因-停开机记录区查-看详情）:不涉及；处理工号（停机原因-停开机记录区查-看详情）:不涉及；无法到厅开机原因:不涉及。	身份核验复机问题
