text	label
用户号码认为,在,对用户号码进行诈骗,冒充公安局，内容:诈骗/疑似诈骗，通话时长:3分钟内，接收电话形式:人工拨打。举报时间,备注:用户要求举报核查处理:被举报号码:（无法识别归属地,无法查询归属地），请派单信安部处理。	用户接到骚扰 / 诈骗电话
客户，通过合作营业厅咨询/办理业务时，对解释说明不清表示不满意，要求核查处理，客服代表安抚无效，请协助处理,业务类型:订购销售品【十全十美79元套餐,营业厅名称:荆州公安狮子口营业厅（刘学芬,工作人员工号/特征:刘学美；存在的服务问题:解释说明不清楚,客户当时办理套餐，工作人员并未告知需要绑定两年使用，现在对此不认可，觉得是欺骗，麻烦核实处理，；客户当时办理套餐，工作人员并未告知需要绑定两年使用，现在对此不认可，觉得是欺骗，麻烦核实处理。	投诉营业厅
杭州删除杭州,增加,14天内行程情况:更新于,您于前14天内到达或途径:咸宁、湖州、杭州；行程轨迹故障现象:多行程；异常省份,用户反映已离开杭州超过14天，但行程里面还是有此记录，请核实。	行程轨迹（多行程、无行程、少行程）
暂无固定节点分类,，故记该节点。用户称只安装了1个ITV，用户称未使用2部ITV，用户对有第二部iTV功能费扣费10元不认可，用户对此不满，用户要求退还从订购开始产生扣费，用户要求取消第二部iTV功能业务及定价,请核实后尽快处理回复,争议类型:月租费争议争议费用情况:大于5元争议月份:从订购开始产生扣费争议扣费记录,赵军,业务,jzi,ITV_第二部iTV功能费,0,0,套餐定价计划:宽带/固话加装高清iTV,ITV月租25元。	费用争议
橙分期投诉原因:还款失败；活动截止时间,办理渠道:东湖高新流芳佛祖岭专营店；红包/橙分期活动描述:华为畅享8e,用户对办理的橙分期不认可，表示办理时未告知需要自己还款，查询从19年7月开始出现逾期,要求尽快处理回复。；用户对办理的橙分期不认可，表示办理时未告知需要自己还款，查询从19年7月开始出现逾期,要求尽快处理回复。	投诉营业厅
用户号码状态正常，发送号码正确且未被对方设置拦截，不认可配合换机测试。	号码正常，短信未拦截，不配合换机测试
用户反映异地号码在湖北办理了异地销户，现在归属地营业厅还没有收到申请，用户要求反馈核实加急处理，现在在等着办理号码，烦请核实，号码归属地和受理销户地:至少有一方为湖北；是否已办理异地销户:是；申请时间:号；7个工作日处理时限:用户不认可；身份证号码归属地:中国电信-广东-佛山；受理销户营业厅:恩施州建始县烟东大道营业厅；无。	用户需办理异地销户
套餐名称:普通电话政企月租35元/月；套餐销售品ID,电子发票投诉问题:重新推送成功仍未收到；开票状态:开票成功；争议月份,发票金额（元,发票邮箱,说要投诉，以前都没出现这种情况，麻烦尽快处理，；昨天就来电开20个左右座机的发票，昨天漏了五个，今天反复来电，都是有漏收的，我这边来电过程中给用户发送，也是收不到，加用户微信，用户也没有通过，麻烦尽快处理。	发票问题
用户异常停机，一个月停了四五次，对反复停机不认可，要值班经理回电，值班经理回电用户忙未接通，故登记此处，烦请回电，停开机类型（停机原因-停开机记录区查-看详情）:身份核验(语音)单停；处理工号（停机原因-停开机记录区查-看详情）:wh；无法到厅开机原因:对停机原因不认可。	异常停机 需要复机
要求取消电子渠道活动-6个月合约,要求一小时内答复，回复。	客户想要取消电子渠道活动-6个月合约,请核实一下
周围用户是否正常】:不清楚【经度】:114,纬度】:30,地址】:武汉市江汉区新湾路盛世江城14栋2单元25楼2503室【地址id,基站id,194【5G开关是否开启】:是【受理号码,故障预处理】:本地上网慢【故障场景】:所有位置【故障发生时间】,点【检测BOSS侧付费模式和欠费情况】:后付费【检测BOSS是否开通5G,SA功能】:是【检测是否5G首话单】:是【检测是否5G终端】:是【检测网元侧SA开户信息是否存在】:存在【检测SA网元侧停开机状态】:4G:停机；5G:停机【检测SA网元侧上下行速率】:5G上行100M,下行1000M【检测30天内是否有未竣工订单】:无在途订单【检测BOSS5G上下行速率】:5G上行:100M,下行:1G【检测5G上网话单（BOSS话单）提供上网记录】:查询失败【是否存在异常话单】:无异常话单【是否被列入AAA黑名单】:否【检测BOSS侧停开机状态】:开机【检测30天内在途工单】:30天内无在途单,检查BOSS是否已经发送达量降速】:查询失败【检测BOSS是否断网】:未断网,检测当前是否有上网超阈值记录】:上网流量没有超断网阀值BOSS开机，UDM平台停机，请核实。	本地无法主被叫/上网
漫游地（省外）:浙江；具体使用地址:浙江杭州余杭区；省际漫游投诉问题:上网；故障发生时间,号码状态:正常；4G-LTE及国漫功能:已开通；手机是否已启用4G功能:已启用；漫出地4G信号覆盖:有4G信号覆盖；手机终端类型:4G终端,前期工单流水，处理结果跟踪用户曾有登网记录，近期未见更新，建议用户重新插拔卡再试，并向漫游地投诉。用户再次来电反映手机号码无法使用流量，手机关机重启也无法使用，用户称套餐两个号码都使用不了流量，麻烦请尽快核实处理。	短信上网语音使用问题
显示有余额，预处理还是欠费停机状态。	有余额被停机
客户，通过自有营业厅咨询/办理业务时，对解释说明不清表示不满意，要求核查处理，客服代表安抚无效，请协助处理,业务类型:关功能【[附]手机签名标准版,营业厅名称:襄州区黄集营业厅(周莉,工作人员工号/特征:杨耀；存在的服务问题:用户称没有退费,前期工单:，已按前期工单回复，用户不认可，并且不认可给她打了电话，坚持要求我司处理之前返还的费用,前期工单:，已按前期工单回复，用户不认可，并且不认可给她打了电话，坚持要求我司处理之前返还的费用。	用户客户反映宽带那个两年的协议当时办理的时候工作人员没有解释说明,请核实一下,用户要求处理问题,请核实后受理
已发号测试短信，用户接收成功但不认可自助排障。	测试短信接收成功，不认可自助排障
客户，通过合作营业厅咨询/办理业务时，对解释说明不清表示不满意，要求核查处理，客服代表安抚无效，请协助处理,业务类型:销售品成员变更【5G云套餐十全十美129元档,营业厅名称:襄城君临山营业厅（实业,工作人员工号/特征:冯露；存在的服务问题:没有告知流量无法结转,核实处理联系；用户称5G云套餐十全十美129元档，只是宽带升级，营业厅把套餐一起升级了，并没有告知，导致流量没有结转到本月，意见大，坚持投诉，联系。	办理业务时，对解释说明不清表示不满意
1.主叫号码,2.受理号码,3.联系号码,4.生单原因宣传与活动不一致5.订单号HBZZSLXDW6.用户需求:,用户称当时办理时收到的宣传纸上写明，用满六个月会额外赠送20元话费，但是用户目前仍未收到,并及时回复。	宣传与活动不一致
用户积分兑换入口:省内积分商城,积分兑换物品类型,积分兑换渠道:湖北电信ITV综合业务管理平台；积分兑换物品:付费频道月包；积分兑换单积分争议类型:否认兑换积分,积分异动日期为:，异动为:兑换/清零，异动积分为:，积分值为:3，兑换凭单号为:，兑换物品为:付费频道月包，兑换渠道为:湖北电信ITV综合业务管理平台称兑换错误，要求退还积分以订购付费产品。	积分兑换
客户反映【HUAWEI】HG8120C-GPON出现故障，查询终端配件设备归属:客户，客户要求核查并处理，请协助跟进。是否在保修范围内:否,反映办理拆机，但没有设备,要求反馈，请核实回复,反映办理拆机，但没有设备,要求反馈，请核实回复。	业务办理问题
反馈自己在网上验证不了。,人目前也不再武汉,看也没有方式可以复通是否停机:是（请进行下一步,停机类型:机标识:大数据分析号码身份核验；停机时间,处理工号是否是hb:否（请场景按照口径答复用户。	线上链接复机不成功
用户反映翼支付红包未返费用户5号已缴费今天还没有返费，请核实回复投诉类型:营销活动（返利、宣传、规则问题）问题类型:参加活动未返利。	翼支付/橙分期活动问题
已发号测试短信，用户接收失败,农业银行,反映收不到农业银行短信，请尽快核实。	测试短信接收失败
用户要求取消电子渠道活动-6个月合约。	客户想要取消电子渠道活动-6个月合约,请核实一下
是放在电话手表中使用，需要尽快复机，是否停机:是（请进行下一步,停机类型:身份核验(语音)单停；停机时间:hbunfraud02；处理工号是否是hb:否（请场景按照口径答复用户。	异常停机 需要复机
客户反映，通过代理服务点咨询/办理业务时，对解释说明不清表示不满意，要求核查处理，客服代表安抚无效，请协助处理,业务类型:费用；营业厅名称:团风小米授权店,用户反映在营业厅办理保底129元套餐抵扣1700元参加购机活动，现在查询到微信上扣款1700元，称营业厅不说清楚，用户，；用户反映在营业厅办理保底129元套餐抵扣1700元参加购机活动，现在查询到微信上扣款1700元，称营业厅不说清楚，用户。	办理业务时，对解释说明不清表示不满意
手机每个月都没有收到账单提醒，要求公司处理，投诉问题场景:话费、流量提醒问题；订购记录场景查询结果:与用户描述一致；综合提醒平台查询结果:与用户描述一致；接收/发送时间:。	短信提醒问题
无法发送彩信,是否设置黑名单:未设置（手机增值一键生单检测,手机是否支持彩信:支持；是否开启手机上网功能:已开通；开关机是否恢复:未恢复。	用户表示彩信无法发送,请核实回复,发送不了彩信了,请核实联系处理
漫游地（省外）:广东；具体使用地址:佛山；省际漫游投诉问题:上网；故障发生时间,号码状态:正常；4G-LTE及国漫功能:已开通；手机是否已启用4G功能:已启用；漫出地4G信号覆盖:有4G信号覆盖；手机终端类型:4G终端,用户反映在湖北手机就无法上网，在佛山还是这样要求尽快处理。	漫游语音/上网问题
称人在外地，对这个号码被限制呼出不认可，我处，故记录此工单，请尽快核实回复,停机类型:骚扰单停；处理工号:hb；通话频繁的原因（不涉及填无）:无；单位全称（个人填个人）:个人；能否提供工作证明:个人使用，不涉及；机主身份姓名:陈天祥；机主身份证辅助项（三选一）:开卡地市；用户不认可项:停机原因。	骚扰单停
已发号测试短信，用户接收成功但不认可自助排障,-07,就能收到电信短信，银行，物业验证码都收不到，不认可换手机测试。	测试短信接收成功，不认可自助排障
用户号码认为,在12月7日15点，,对用户号码进行骚扰，内容:，通话时长:3分钟内，接收电话形式:人工拨打。举报时间,备注:用户要求举报核查处理:被举报号码:（中国电信-浙江）请派单省业务平台维护中心处理。	用户接到骚扰 / 诈骗电话
套餐名称:99元大流量卡(2018版,套餐销售品ID,争议月份,争议金额:109；停机记录:,欠费双停,处理成功,处理成功,plca；扣费记录:套餐使用费,要求退费；用户对停机后仍收取费用不认可，要求处理费用。（自己是海外回归人员目前处在隔离期不方便去营业厅，要求能在电话中处理好。	费用争议
漫游地（省外）:广东省；具体使用地址:广东省惠州市惠东；省际漫游投诉问题:上网；故障发生时间:2021月11月21日；号码状态:正常；4G-LTE及国漫功能:已开通；手机是否已启用4G功能:已启用；漫出地4G信号覆盖:有4G信号覆盖；手机终端类型:4G终端,告知用户，我处核实用户语音数据正常，呼叫权限及漫游权限:国内。目前状态为关机状态，拨测用户为关机音。请检查机卡。4G数据功能正常，漫游权限已开，跟踪用户曾有登网记录，近期未见更新，建议用户重新插拔卡再试，并向漫游地投诉，用户认可,已按照前期工单处理结果告知用户，用户不认可，称手机关机重启换手机都试过了还是不行。	语音或上网无法使用
短信故障现象:无法收发；短信拦截类型:拦截；测试短信情况:不涉及,12月14日,工单处理时限提醒话术:我们马上核实处理，36小时内会有专人联系您。	用户接到骚扰 / 诈骗电话
省网优预,用户开通VoLTE，注册VoLTE。用户呼入呼出状态正常。一键检测数据正常，无异常话务拦截，1502时间联系用户坚持称在所有位置通话故障未恢复,请进一步核实,周围用户是否正常】:是【经度】:114,纬度】:30,地址】:武汉市东西湖区吴家山街田园里135号401室【地址id,基站id,受理号码,故障预处理】:本地无法主被叫【故障场景】:所有位置【故障现象】:有信号，正常【故障发生时间】,点【检测BOSS侧付费模式和欠费情况】:后付费【是否存在异常话单】:无异常话单【HLR用户是否登网（关机状态检测,关机【HLR漫游权限查询】:国内漫游【检测BOSS侧停开机状态】:开机【检测30天内在途工单】:30天内无在途单【检测HLR侧停开机状态】:开机【呼叫权限】:国内呼叫【MSCID位置（仅供内部参考,检测无异常，有位置信息:湖北省武汉【检测无线网状况是否故障】:正常【检测当前是否有拨异网号码超阈值记录】:拨异网号码语音时长没有达阀值【检测HSS中VoLTE数据状态】:查询失败【检测VOLTE平台用户状态】:查询失败【检测ENUM开户数据是否存在】:正常【检测用户volte注册状态】:正常有MSCID位置信息已建议用户换机换卡，用户未恢复，双方开通4G:是；双方开通VOLTE:是；Volte开关启用:是；对方为电信Volte用户:是（可支持高清视频通话,苹果或携转用户:是（直接答复不支持,有无4G信号:是。	语音或上网无法使用
省网优预,一键检测数据正常，后付费，无智能网业务，无异常话务拦截，VOLTE呼入呼出状态正常，联系用户，其称打电话提示安全隐患，已去营业厅做了复机还是有此情况,请进一步核实。重复来电回访用户，此手机已经在营业厅做过复机，也重启过手机，但是现在拨打电话还是提示有安全隐患，无法呼出，我处停机原因场景显示此手机号是正常状况,前期工单节点是否为:全业务受理,移动业务(前台专用):是；全业务受理,移动业务(前台专用)工单流水,疑难场景:网络质量工单催单3次及以上；工单回复时限:-时段:3小时以内联系；双方开通4G:是；双方开通VOLTE:是；Volte开关启用:是；对方为电信Volte用户:是（可支持高清视频通话,苹果或携转用户:是（直接答复不支持,有无4G信号:是。	语音或上网无法使用
用户称前期办理了装机业务，宽带安装了机顶盒未安装，现要求将机顶盒安装上，请尽快核实联系，优先通过催装移场景诊断:是（请优先通过来电首页-催装移场景处理,流程是否竣工:是；是否已上门安装:是（请记录故障工单报障,受理订单产品类型:ITV；业务受理类型:装机。	安装宽带、itv、摄像头
用户号码认为在,对用户号码进行骚扰，内容:，通话时长:3分钟内，接收电话形式:人工拨打。举报时间,备注:用户要求举报核查处理:被举报号码:（无法识别归属地,无法查询归属地），请派单信安部处理。	无法查询归属地,请派单信安部处理
用户号码认为在，,对用户号码进行骚扰，用户要求屏蔽，内容:卫生保健，通话时长:3分钟内，接收电话形式:人工拨打。举报时间,备注:用户要求举报核查处理:被举报号码:（无法识别归属地,无法查询归属地），请派单信安部处理。	用户接到骚扰 / 诈骗电话
用户积分兑换入口:省内积分商城,积分兑换物品类型:实物；积分兑换渠道:集团号百积分商城兑换凭单；积分兑换物品:不锈钢多功能大容量汤蒸锅两层蒸锅火锅家用煮粥锅具电磁炉；积分兑换单号:BTGoods；积分争议类型:礼品质量问题,前期工单，已按备注告知,表示之前告知周一联系，到现在还未联系其，对此意见很大，表示会致电投诉，烦，；前期工单，已按备注告知,表示之前告知周一联系，到现在还未联系其，对此意见很大，要求马上处理，烦。	业务办理问题
故障发生时间,省际漫游投诉问题:上网；漫入号码归属省:广东；号码状态:号码正常\用户不配合；手机是否启用4G:已启用；手机终端类型:5G终端；漫入地4G信号覆盖情况:有4G信号覆盖；故障地址:武汉市蔡甸区大集街花园湾一街阳森产业园综合楼3楼301室；地图经度:114,地图纬度:30,在所有的地方都无法正常使用数据流量，已联系归属地卡片状态无异常情况。请尽快核实处理。	漫游语音/上网问题
原工单流水号:，此工单为重新生单。客户来电表示宽带有余额被停机，表示不认可，并回复。	有余额被停机
省网优预,1521多次致电用户都无法接听，工单显示无法接听134号段的电话，核实费用数据HLR正常，开通并使用volote，呼入呼出状态正常，无互斥业务，无异常话务，请进一步核实。【周围用户是否正常】:是【经度】:114,纬度】:30,地址】:武汉市洪山区张家湾街【地址id,基站id,受理号码,故障预处理】:本地无法被叫【故障场景】:所有位置【故障现象】:有信号，正常【故障发生时间】,点【检测BOSS侧付费模式和欠费情况】:后付费【是否存在异常话单】:无异常话单【HLR用户是否登网（关机状态检测,关机【HLR漫游权限查询】:国内漫游【检测BOSS侧停开机状态】:开机【检测30天内在途工单】:30天内无在途单【检测HLR侧停开机状态】:开机【MSCID位置（仅供内部参考,检测无异常，有位置信息:湖北省武汉【呼叫转移】:无呼叫转移【呼入权限】:不限制【检测无线网状况是否故障】:正常【检测HSS中VoLTE数据状态】:BOSS未开通VOLTE功能【检测VOLTE平台用户状态】:BOSS未开通VOLTE功能【检测ENUM开户数据是否存在】:BOSS未开通VOLTE功能【检测用户volte注册状态】:BOSS未开通VOLTE功能MSCID位置信息已建议用户换机换卡，用户未恢复，用户称是所有134开头的号码都打不进来，号段的可正常接通，换机换卡都尝试过没用，并且否认设置了黑名单。是否为单个通信异常:否；呼入或呼出不畅:呼入。	本地无法主被叫/上网
客户，通过自有营业厅咨询/办理业务时，对解释说明不清表示不满意，要求核查处理，客服代表安抚无效，请协助处理,业务类型:销售品成员变更【5G云套餐十全十美399元档,营业厅名称:鄂州华容营业厅（武汉二洲,工作人员工号/特征:张欢欢；存在的服务问题:套餐资费没有解释清楚,自己通过营业厅办理的5G云套餐十全十美399元档套餐，5G套餐的分钟数不够使用，用户强烈要求恢复为原4G套餐，长时间，用户坚持要求我处登记反映，请核实,自己通过营业厅办理的5G云套餐十全十美399元档套餐，5G套餐的分钟数不够使用，用户强烈要求恢复为原4G套餐，长时间，用户坚持要求我处登记反映，请核实。	办理业务时，对解释说明不清表示不满意
客户，通过合作营业厅咨询/办理业务时，对解释说明不清表示不满意，要求核查处理，客服代表安抚无效，请协助处理,业务类型:销售品成员变更【智家666礼包-全家通129版(松融合,营业厅名称:新洲阳逻四号路全网通卖场；工作人员工号/特征:甘凤琴；存在的服务问题:对用户态度非常不好,用户今天去营业厅将5G套餐取消，但营业厅工作人员表示之前参加了活动，赠送了智能门铃的业务。现在协议没有到期，提前取消需要退还话费。用户不认可，表示之前参加活动交了666都没有要求退还，而且之前工作人员办理套餐也并没有说明这一点。要求核实解决此问题。；用户今天去营业厅将5G套餐取消，但营业厅工作人员表示之前参加了活动，赠送了智能门铃的业务。现在协议没有到期，提前取消需要退还话费。用户不认可，表示之前参加活动交了666都没有要求退还，而且之前工作人员办理套餐也并没有说明这一点。要求核实解决此问题。	投诉营业厅
周围用户是否正常】:是【经度】:112,纬度】:31,地址】:襄阳市宜城市襄沙大道种子公司门面宜信房产南面墙壁1-1号箱用户04【地址id,基站id,受理号码,故障预处理】:本地无法主被叫【故障场景】:所有位置【故障现象】:有信号，正常【故障发生时间】,点【检测BOSS侧付费模式和欠费情况】:后付费【是否存在异常话单】:无异常话单【HLR用户是否登网（关机状态检测,关机【HLR漫游权限查询】:国内漫游,检测BOSS侧停开机状态】:开机【检测30天内在途工单】:30天内无在途单,检测HLR侧停开机状态】:开机【呼叫权限】:国内呼叫【MSCID位置（仅供内部参考,检测无异常，有位置信息:湖北省襄樊【检测无线网状况是否故障】:正常【检测是否是5G用户】:是5G用户【检测当前是否有拨异网号码超阈值记录】:拨异网号码语音时长没有达阀值【检测HSS中VoLTE数据状态】:查询失败,检测VOLTE平台用户状态】:查询失败,检测ENUM开户数据是否存在】:正常【检测用户volte注册状态】:正常重启手机或拔插卡，用户未恢复。	语音或上网无法使用
用户号码认为在12月14，,对用户号码进行骚扰，一直拨打用户的电话称找人，之前打了一天，今天打了一上午。，内容:，通话时长:3分钟内，接收电话形式:人工拨打。举报时间,备注:用户要求举报核查处理:被举报号码:（中国联通-北京）请派单省业务平台维护中心处理。	用户接到骚扰 / 诈骗电话
故障地址】:武汉市江汉区鼓楼街世纪江尚8栋【周围用户是否正常】:不清楚【经度】:114,纬度】:30,地址,武汉市江汉区鼓楼街世纪江尚8栋【地址id,基站id,受理号码,故障预处理】:本地无法主被叫【故障场景】:部分/单一位置【故障现象】:信号弱，不稳定【故障发生时间】,点【检测BOSS侧付费模式和欠费情况】:后付费【是否存在异常话单】:无异常话单【HLR用户是否登网（关机状态检测,开机【HLR漫游权限查询】:国内漫游,检测BOSS侧停开机状态】:开机【检测30天内在途工单】:30天内无在途单,检测HLR侧停开机状态】:开机【呼叫权限】:国内呼叫【MSCID位置（仅供内部参考,检测无异常，有位置信息:湖北省武汉【检测无线网状况是否故障】:正常【检测是否是5G用户】:是5G用户【检测当前是否有拨异网号码超阈值记录】:拨异网号码语音时长没有达阀值【检测HSS中VoLTE数据状态】:正常【检测VOLTE平台用户状态】:用户可以正常呼出呼入【检测ENUM开户数据是否存在】:ENUM开户数据存在【检测用户volte注册状态】:用户未注册VOLTE功能重启手机或拔插卡，用户未恢复。	语音或上网无法使用
用户号码认为在12月8日，,对用户号码进行骚扰。用户要求举报屏蔽。，内容:欠款催收，通话时长:3分钟内，接收电话形式:人工拨打。举报时间,备注:用户要求举报核查处理:被举报号码:（中国移动-湖南）请派单省业务平台维护中心处理。	用户接到骚扰 / 诈骗电话
不在使用要求取消，电渠5G升级包49元档5折（6个月。	费用争议
