text	label
故障地址】:武汉市江汉区汉中路188号军威小区底层市场军威塑料市场【周围用户是否正常】:不清楚【经度】:114,纬度】:30,地址】:武汉市江汉区汉中路188号军威小区底层市场军威塑料市场【地址id,基站id,受理号码,故障预处理】:本地无法主被叫【故障场景】:部分/单一位置【故障现象】:信号弱，不稳定【故障发生时间】,点【检测用户volte注册状态】:用户未注册VOLTE功能【检测ENUM开户数据是否存在】:查询失败【检测VOLTE平台用户状态】:查询失败【检测HSS中VoLTE数据状态】:正常【检测当前是否有拨异网号码超阈值记录】:拨异网号码语音时长没有达阀值【检测是否是5G用户】:是5G用户【检测无线网状况是否故障】:正常【MSCID位置（仅供内部参考,检测无异常，有位置信息:湖北省武汉【呼叫权限】:国内呼叫【检测HLR侧停开机状态】:开机【检测30天内在途工单】:30天内无在途单,检测BOSS侧停开机状态】:开机【HLR漫游权限查询】:国内漫游,HLR用户是否登网（关机状态检测,开机【是否存在异常话单】:无异常话单【检测BOSS侧付费模式和欠费情况】:后付费重启手机或拔插卡，用户未恢复。	本地无法主被叫/上网
用户号码状态正常，发送号码正确且未被对方设置拦截，不认可配合换机测试，所有。	号码正常，短信未拦截，不配合换机测试
充值渠道:第三方渠道充值（如支付宝、微信、银行卡等,充值问题类型:充值未到账；充值号码,充值金额（元）:50元；充值时间,交易流水,尽快到账；通过中国银行11月30日充值50元未到账，（已截图），已联系银行客服，他们表示已充值到电信，要求电信查询，目前有订单号码和商户订单号码，没有交易流水号码，意见大，强烈要求协助处理IM号:oTkr9juXVv26svImpoTz8_IVPnP4。	充值缴费问题
省网优预,经核实用户号码数据正常，无话务拦截，无呼叫转移，用户开通VoLTE，未已注册VoLTE。用户呼入呼出状态正常。用户称这个电话无法给自己打电话，提示关机，换机测试无效，确认无拦截，数据。请相关工作人员核实回复用户,周围用户是否正常】:是【经度】:113,纬度】:31,地址】:孝感市孝南区肖港镇孝大路菜场37号旁111号光分8号地址【地址id,基站id,49【受理号码,故障预处理】:本地无法被叫【故障场景】:所有位置【故障现象】:有信号，正常【故障发生时间】,点【检测BOSS侧付费模式和欠费情况】:后付费【是否存在异常话单】:无异常话单【HLR用户是否登网（关机状态检测,关机【HLR漫游权限查询】:国内漫游【检测BOSS侧停开机状态】:开机【检测30天内在途工单】:30天内无在途单【检测HLR侧停开机状态】:开机【MSCID位置（仅供内部参考,检测无异常，有位置信息:湖北省孝感【呼叫转移】:无呼叫转移【呼入权限】:不限制【检测无线网状况是否故障】:正常【检测HSS中VoLTE数据状态】:正常【检测VOLTE平台用户状态】:用户可以正常呼出呼入【检测ENUM开户数据是否存在】:ENUM开户数据存在【检测用户volte注册状态】:用户已注册VOLTE功能MSCID位置信息已建议用户换机换卡，用户未恢复，称这个电话无法给自己打电话，提示关机，换机测试无效，确认无拦截，确认号码状态正常，现对此不认可，意见较大，回复,双方开通4G:是；双方开通VOLTE:是；Volte开关启用:是；对方为电信Volte用户:是（可支持高清视频通话,苹果或携转用户:是（直接答复不支持,有无4G信号:是。	本地无法主被叫/上网
短信故障现象:无法收发；短信拦截类型:拦截；测试短信情况:不涉及,工单处理时限提醒话术:我们马上核实处理，36小时内会有专人联系您。	短信无法收发
用户反映号码，对.12月的费用有争议，费用争议的销售品名称:5G畅享129元套餐，销售品ID:，销售品编码:，争议费用金额:-元，定价描述:5G畅享129元套餐。扣费明细,129,129,19,19费用，；称自己号码一直未使用，前期客户经理告知优惠减免，6月份异常停机，现在对此欠费不认可，要求电信处理。请核实。	费用争议
客户，通过合作营业厅咨询/办理业务时，对解释说明不清表示不满意，要求核查处理，客服代表安抚无效，请协助处理,业务类型:新装【电信手机,营业厅名称:宜昌猇亭云迅天翼专营店；工作人员工号/特征:赵小蓉；存在的服务问题:解释不清,尽快核实；用户称昨天在该营业厅办理了业务已经交费了200，现在欠费了需要核实。	用户对套餐欠费不认可
:在线退订失败,用户要求取消业务SP编码/产品编码:,商品名称/扣费项:王者荣耀专属包,资费:10用户要求退费SP编码/产品编码:,商品名称/扣费项:王者荣耀专属包,资费:10反映自己没有订购过，今天收到自己扣费的短信，用户否认办理。	退订增值业务并退费
用户号码认为,在，,屏蔽拦截这个号码，对用户骚扰造成了困扰，内容:，通话时长:3分钟内，接收电话形式:人工拨打。举报时间,备注:用户要求举报核查处理:被举报号码:（中国移动-湖北）请派单省业务平台维护中心处理。	用户接到骚扰 / 诈骗电话
用户反映自己是在老家安装宽带赠送使用一段时间就没有使用，否认频繁通话。现在不在归属地无法去营业厅复机，停机类型:骚扰单停；处理工号:es；通话频繁的原因（不涉及填无）:无；单位全称（个人填个人）:个人；能否提供工作证明:个人使用，不涉及；机主身份姓名:顿伟；机主身份证辅助项（三选一）:开卡地市；用户不认可项:停机原因。	骚扰单停
用户号码状态正常，发送号码正确且未被对方设置拦截，不认可配合换机测试，-10。	号码正常，短信未拦截，不配合换机测试
故障发生时间,省际漫游投诉问题:上网；漫入号码归属省:重庆；号码状态:号码正常\用户不配合；手机是否启用4G:已启用；手机终端类型:4G终端；漫入地4G信号覆盖情况:有4G信号覆盖；故障地址:武汉市东西湖区三店中路纽兰药业7号附13；地图经度:114,地图纬度:30,地图基站id:_48,反映网络使用很慢，周围用户信号都不好。	语音或上网无法使用
1.主叫号码,2.受理号码,3.联系号码,4.生单原因用户要求撤单5.订单号XW6.用户需求:,不需要了,要求撤单。	宣传与活动不一致
已发号测试短信，用户接收成功但不认可自助排障,）其昨天中午一点至今天下午5点间，多条建设银行的消费短信没有收到，询问原因。	测试短信接收成功，不认可自助排障
已发号测试短信，用户接收成功但不认可自助排障,杏林大家公众。	测试短信接收成功，不认可自助排障
已发号测试短信，用户接收成功但不认可自助排障,-15,自己手机收不到验证码，短信可以正常接收，用户比较急。	测试短信接收成功，不认可自助排障
前期流水:，用户反映联系湖北电信微信客服告知处理不了，意见大，请尽快核实处理，停机类型:骚扰单停；处理工号:hb；通话频繁的原因（不涉及填无）:无；单位全称（个人填个人）:个人；能否提供工作证明:个人使用，不涉及；机主身份姓名:王霄霄；机主身份证辅助项（三选一）:开卡地市；用户不认可项:。	骚扰单停
坚称手机余额不足未收到任何短信提醒导致宽带欠费停机,请尽快核实处理。投诉问题场景:话费、流量提醒问题；订购记录场景查询结果:提醒类不涉及；综合提醒平台查询结果:与用户描述一致；接收/发送时间:。	短信提醒问题
客户，通过自有营业厅咨询/办理业务时，对解释说明不清表示不满意，要求核查处理，客服代表安抚无效，请协助处理,业务类型:销售品成员变更【5G云套餐十全十美169元档,营业厅名称:蔡甸大集全网通千年美丽专营店；工作人员工号/特征:肖雄军；存在的服务问题:0,用户要求处理流量费用；称当时办理卡被告知是无限流量的，用户不知道使用流量超了要收费，用户对当初办理的情况不认可，并退还流量费用，麻烦核实处理。	业务办理问题
用户号码状态正常，发送号码正确且未被对方设置拦截，不认可配合换机测试，-11,用户称无法对所有号码无法发送短信，关机重启无效，麻烦核实。	号码正常，短信未拦截，不配合换机测试
1.赠送/购买时间及地点（业务办理时间）:无记录,新装日期,2.是否立即激活:已激活3.终端来源:赠送4.投诉场景:5.详细描述:用户反映目前宽带不需要使用了，需要去营业厅办理销户，挽留无效，解释需要机主本人携带证件，以及如果有电信提供的设备需要带上，用户称最开始自己办理时答应的就是用满两年设备就赠送给自己，目前为什么要归还，对此有疑问。	安装宽带、itv、摄像头
反映要求线上复机，已按口径解释，但是用户仍不认可，表示目前人在外地，无法去归属地营业厅复机，请协调处理,停机类型:骚扰单停；处理工号:hb；通话频繁的原因（不涉及填无）:通知亲戚朋友消息；单位全称（个人填个人）:个人；能否提供工作证明:个人使用，不涉及；机主身份姓名:管丹丹；机主身份证辅助项（三选一）:开卡年份；用户不认可项:停机原因。	骚扰单停
周围用户是否正常】:否【经度】:114,纬度】:30,地址】:武汉市江汉区江旺路1号电信客服中国电信江旺路营业厅1楼101室【地址id,基站id,受理号码,故障预处理】:本地无法主被叫【故障场景】:所有位置【故障现象】:有信号，正常【故障发生时间】,点【检测BOSS侧付费模式和欠费情况】:后付费【是否存在异常话单】:无异常话单【HLR用户是否登网（关机状态检测,关机【HLR漫游权限查询】:国内漫游,检测BOSS侧停开机状态】:开机【检测30天内在途工单】:30天内无在途单,检测HLR侧停开机状态】:开机【呼叫权限】:国内呼叫【MSCID位置（仅供内部参考,无位置信息【检测无线网状况是否故障】:正常【检测是否是5G用户】:是5G用户【检测当前是否有拨异网号码超阈值记录】:拨异网号码语音时长没有达阀值【检测HSS中VoLTE数据状态】:查询失败,检测VOLTE平台用户状态】:查询失败,检测ENUM开户数据是否存在】:正常【检测用户volte注册状态】:正常重启手机或拔插卡，用户未恢复。	语音或上网无法使用
用户号码状态正常，发送号码正确且未被对方设置拦截，不认可配合换机测试。	号码正常，短信未拦截，不配合换机测试
用户号码认为在,用户反应这些固定电话总是打电话骚扰到自己，要求公司拦截屏蔽处理，内容:欠款催收，通话时长:3分钟内，接收电话形式:人工拨打。举报时间,备注:用户要求举报核查处理:被举报号码:（无法识别归属地,无法查询归属地），请派单信安部处理。	无法查询归属地,请派单信安部处理
漫游地（省外）:江苏；具体使用地址:江苏省连云港连云区晟宏量化；省际漫游投诉问题:上网；故障发生时间,号码状态:正常；4G-LTE及国漫功能:已开通；手机是否已启用4G功能:已启用；漫出地4G信号覆盖:有4G信号覆盖；手机终端类型:4G终端,同流水号:反映的问题，问题未解决，客户还是上不了网，非常卡，请联系处理,前期工单用户无法正常上网；,核实用户HSS上4G数据正常，国内漫游功能已开，跟踪用户（上网时间记录,有正常登网记录，建议用户直接向漫游地号报障解决。	本地无法主被叫/上网
短信故障现象:无法收发；短信拦截类型:未拦截；测试短信情况:不涉及,生单原因:短信权限问题导致无法发送,工单处理时限提醒话术:我们马上核实处理，36小时内会有专人联系您。	短信无法收发
用户称通过查询行程码无结果,投诉问题场景:行程轨迹问题（请在业务内容中注明漫游地,订购记录场景查询结果:提醒类不涉及；综合提醒平台查询结果:无记录\不一致（直接答复,接收/发送时间:不涉及。	短信提醒问题
短信故障现象:无法收发；短信拦截类型:未拦截；测试短信情况:不涉及,生单原因:短信权限问题导致无法发送,工单处理时限提醒话术:我们马上核实处理，36小时内会有专人联系您。	短信无法收发
用户号码状态正常，发送号码正确且未被对方设置拦截，不认可配合换机测试，移动和联通,用户要求半个小时回电，加急。	短信无法发送
用户号码认为,在，,对用户号码进行骚扰,自己不认识,要求举报,屏蔽0085开头的号码，内容:，通话时长:3分钟内，接收电话形式:人工拨打。举报时间,备注:用户要求举报核查处理:被举报号码:（无法识别归属地,无法查询归属地），请派单信安部处理。	用户接到骚扰 / 诈骗电话
称此号码在网上办理，用了几天突然停机了需要去营业厅办理复机,人目前在上海，刚冲了50元话费不能使用，要求在线处理,停开机类型（停机原因-停开机记录区查-看详情）:非实名违章单停；处理工号（停机原因-停开机记录区查-看详情）:hb；无法到厅开机原因:人在上海。	用户反应机主在外地,需要线上复机！,用户要求线上开机,用户意见很大有越级投诉倾向,请核实联系
用户人在外地，无线上复机链接，强烈要求在线开机，请核实尽快联系处理,停开机类型（停机原因-停开机记录区查-看详情）:二次实人核验单停；处理工号（停机原因-停开机记录区查-看详情）:es；无法到厅开机原因:人在外地。	用户反应机主在外地,需要线上复机！,用户要求线上开机,用户意见很大有越级投诉倾向,请核实联系
用户称号码是业务号码，打电话比较频繁，现在停机，由于自己不在武汉，无法从山东回武汉办理开机业务，用户要求开机,停机类型:骚扰单停；处理工号:hb；通话频繁的原因（不涉及填无）:用户称是因为工作问题，需要频繁拨打电话；单位全称（个人填个人）:于灿伟；能否提供工作证明:个人使用，不涉及；机主身份姓名:于灿伟；机主身份证辅助项（三选一）:开卡年份；用户不认可项:停机原因。	骚扰单停
1.否认办理业务:不办理返费活动了2.受理渠道:湖北电子渠道运营中心（自动,3.订单记录:购物车流水:4.机主身份证:5.用户要求:否认办理，根据办理订单解释，用户不认可，不办理返费活动了,要求取消,钱退给用户。	否认改套餐、办理业务
反映目前本人在广东，最近无法回武汉，因送外卖经常联系客户才通话频繁，要求复机，烦,停机类型:骚扰单停；处理工号:hb；通话频繁的原因（不涉及填无）:送外卖；单位全称（个人填个人）:个人；能否提供工作证明:无法提供（直接答复,机主身份姓名,机主身份证号:黄德换；辅助项（三选一）:开卡年份；用户不认可项:。	身份核验复机问题
用户宽带有费用催缴，用户很烦，催缴的方式:短信催缴；催缴的号码,催缴的时间,查询是否有短信催缴记录（路径:停机原因场景-短信提醒查询）:是（与用户描述一致,投诉场景:宽带未到期就开始催缴（直接答复宽带到期前3个月会开始催缴。	催缴提醒问题
反映，在翼支付参加京东与电信合作PULS会员，自己9月10月份会员权益未领取，加急退还，请核实回复。	客户需求,取消并争议费用
同前期流水问题产生原因:用户对多次停机不认可，原因,经查，用户因身份核验语音单停，已告知用户复机途径，知晓复机流程，需要了解语音单停的具体原因，不能无故一直停机就实名复机，此问题我处无法解答；,联系用户情况:已联系上用户；,联系电话,用户投诉问题是否属实:是；,满意度:一般（7分,已复机但是前期并未告知都是正常使用为什么会反复停机，不认可停机情况，要求给一个准确的答复，意见很大。停开机类型（停机原因-停开机记录区查-看详情）:身份核验(语音)单停；处理工号（停机原因-停开机记录区查-看详情）:xgdxjfa13；无法到厅开机原因:用户对多次停机不认可，原因。	身份核验复机问题
副卡是自己家人在用，人在外地，需要协助复机，请核实停开机类型（停机原因-停开机记录区查-看详情）:二次实人核验单停；处理工号（停机原因-停开机记录区查-看详情）:hbunfraud01；无法到厅开机原因:人卡分离。	用户反应机主在外地,需要线上复机！,用户要求线上开机,用户意见很大有越级投诉倾向,请核实联系
短信故障现象:无法收发；短信拦截类型:拦截；测试短信情况:不涉及,工单处理时限提醒话术:我们马上核实处理，36小时内会有专人联系您。	短信无法收发
用户号码认为,在，,这两个号给用户打电话问用户是否认识某某，用户说不认识挂了电话后就收到了几十条短信验证码,内容:，通话时长:3分钟内，接收电话形式:人工拨打。举报时间,备注:用户要求举报核查处理:被举报号码:（无法识别归属地,无法查询归属地），请派单信安部处理。	用户接到骚扰 / 诈骗电话
取消退费,黎跃进,C网彩铃内容费。	费用争议
短信故障现象:无法收发；短信拦截类型:拦截；测试短信情况:不涉及,工单处理时限提醒话术:我们马上核实处理，36小时内会有专人联系您。	短信无法收发
短信故障现象:无法收发；短信拦截类型:拦截；测试短信情况:不涉及,工单处理时限提醒话术:我们马上核实处理，36小时内会有专人联系您。	短信无法收发
漫游地（省外）:深圳；具体使用地址:深圳市光明区中山大学；省际漫游投诉问题:语音或语音、上网均无法使用；故障发生时间,号码状态:正常；漫游功能:已开通,无法正常拨打电话，已试过开关机重启仍无法恢复，周围用户都正常，请尽快核实联系。	漫游语音/上网问题
用户号码状态正常，发送号码正确且未被对方设置拦截，不认可配合换机测试，-09。	号码正常，短信未拦截，不配合换机测试
1.否认办理业务:更改套餐2.受理渠道:湖北省瑞信天成政企营业厅3.订单记录:购物车流水:4.机主身份证:5.用户要求:否认办理，根据办理订单解释，用户不认可。	否认改套餐、办理业务
用户反映之前订购流量包没有订购成功导致自己流量超了很多，用户对此意见大。	业务办理问题
用户号码状态正常，发送号码正确且未被对方设置拦截，不认可配合换机测试，-01。	号码正常，短信未拦截，不配合换机测试
用户反映在翼支付里充值50元话费，交费助手显示优惠了三十多，只需要缴费十九块多，但是过几天后直接从银行卡里扣除了三十元，用户要求不从银行卡里扣除费用，直接一次性付完所有费用。	翼支付/橙分期活动问题
"因前期工单无法转单省公司，故重新记单,自己号码已经办理了注销，但是号码多余的费用工作人员告知自己退还不了,对此不满洪山广场营业厅:客服记单有误。用户号码于,在南京欣网网上卖场新装，后于在霍营营业厅申请异地销户，客服审核通过后我处于协助办理拆机，订单流水号。见工单联系用户，新装时工作人员告知该号码不用缴费，现办理注销时产生了欠费，对此费用表示不认可，因欠费无法办理注销故才交费，现要求退还已缴纳的费用，故请转入网部门核实,南京欣网网上卖场,陈娟受理员工	陈娟,【工号:hb】	受理渠道	南京欣网网上卖场HB开头非武汉本地工号，请省公司核实处理。"	业务办理问题
1.IMEI1:2.IMEI2:3.购买渠道:旗舰店4.用户需求:用户称从未收到过5G信号，已经一年了，手机上的联通卡就有5G信号，劳烦核实。	网络信号问题
宽带故障已经有半个月了，一直没有恢复，每次来电都说当天下午恢复，要求赔偿，请回复争议类型:故障类费用争议争议费用情况:大于5元争议月份:12月争议扣费记录,故障发生时间:11月30故障恢复时间:12月7日用户是否主动要求赔付:是。	费用争议
客户，通过合作营业厅咨询/办理业务时，对办理差错表示不满意，要求核查处理，客服代表安抚无效，请协助处理,业务类型:销售品退订【购机享翼支付权益金1200元（50元/月×24月,营业厅名称:江汉杨汊湖中百仓储专营店；工作人员工号/特征:杨磊；存在的服务问题:用户称没有要求退订,用户称没有要求退订【购机享翼支付权益金1200元（50元/月×24月)】活动，改为现在的5G套餐，到用户最后一期红包没有返还，请核实；用户称没有要求退订【购机享翼支付权益金1200元（50元/月×24月)】活动，改为现在的5G套餐，到用户最后一期红包没有返还，请核实。	投诉营业厅
今天早上10点在营业厅办理携入，但一直到现在手机只能打客服和发短信，其它功能无法使用，希望能尽快处理。	投诉营业厅
用户号码认为,在，,对用户号码进行骚扰,多方来电询问用户是不是,用户名下,接连受到骚扰，影响到生活，用户对此意见大，要求拦截举报，并向保险、银行等部门删除相关联系信息，请尽快核实处理,内容:，通话时长:3分钟内，接收电话形式:人工拨打。举报时间,备注:用户要求举报核查处理:被举报号码:（无法识别归属地,无法查询归属地），请派单信安部处理。	用户接到骚扰 / 诈骗电话
用户称在网上办理的时页面提示每月月租3元，并且没有提示30GB流量是定向流量，对宣传与实际使用不一致不认可，强烈。	宣传与活动不一致
客户，通过代理服务点咨询/办理业务时，对解释说明不清表示不满意，要求核查处理，客服代表安抚无效，请协助处理,业务类型:订购销售品【5G云套餐十全十美129元档,营业厅名称:温泉中百博仁电信专营店；工作人员工号/特征:张文,同上；用户反映上个月更改套餐没有告知流量不结转，意见大，请尽快核实处理。	办理业务时，对解释说明不清表示不满意
漫游地（省外）:广州；具体使用地址:广州广谱；省际漫游投诉问题:语音或语音、上网均无法使用；故障发生时间,号码状态:正常；漫游功能:已开通,客户来电表示昨天开始收集上网和语音都不能使用，短信也不能使用，并回电。	语音或上网无法使用
漫游地（省外）:湖南省；具体使用地址:郴州；省际漫游投诉问题:上网；故障发生时间:号；号码状态:正常；4G-LTE及国漫功能:已开通；手机是否已启用4G功能:已启用；漫出地4G信号覆盖:有4G信号覆盖；手机终端类型:4G终端,反映手机上网最近很慢，重启手机都不好用，交了话费就好一点，麻烦核实处理一下。	漫游语音/上网问题
已发号测试短信，用户接收失败,-07,）用户称无法收到发送的短信，请尽快核实。	测试短信接收失败
已发号测试短信，用户接收失败,所有的号码都收不到。	测试短信接收失败
用户反映开通高清通话后通话过程中无法使用网络，手机上有hd的标识，自己手机型号是小米mix4双方开通4G:是；双方开通VOLTE:是；Volte开关启用:是；对方为电信Volte用户:是（可支持高清视频通话,苹果或携转用户:否（机型参考知识库volte业务文章的附件,有无4G信号:是。	本地无法主被叫/上网
需要这个号码不能正常使用了，用户不是湖北人不能前往营业厅办理身份核验的业务，用户要求在白天的上午11点前电话联系，回复，停开机类型（停机原因-停开机记录区查-看详情）:沉默移动卡保护性单停；处理工号（停机原因-停开机记录区查-看详情）:不涉及；无法到厅开机原因:本人不在本地。	异常停机 需要复机
用户号码状态正常，发送号码正确且未被对方设置拦截，不认可配合换机测试，-03。	号码正常，短信未拦截，不配合换机测试
用户反映宽带未安装,优先通过催装移场景诊断:否（前新装订单,流程是否竣工:是；是否已上门安装:否；受理订单产品类型:宽带；业务受理类型:装机。	安装宽带、itv、摄像头
